review,classification
No Negative We were there for a birthday and found a happy birthday sign and a card in our upgraded room signed by all of the management The room itself overlooking the gardens was quiet and well kept the hotel ideally located The staff was continually forthcoming and friendly We also enjoyed the heated terrace next to the bar ideal for a nightcap and evening smoke All in all we are very happy to recommend The Montague On The Gardens ,good
 What I would suggest the hotel to look at long queues at the reception desk breakfast could have been better  The hotels appearance is amazing The staff was nice and helpful The first double room was TINY but the staff kindly switched us to a nicer twin bed room on our demand on the second day ,good
 Cofee finished during breakfast plates were out during breakfast Cool atmosphere young and dynamic staff,good
 The wifi is not as seamless as I would have liked requires re signing in after every session I believe this may only be for Apple lap tops  Proximity to Paddington station very attentive and polite staff super breakfast with loads of healthy options small but lovely room 24 7 gym ,good
No Negative Nice top floor balcony nice staff,good
 Really petty but extra milk sachets in the room would have been nice Very very helpful and pleasant staff Lovely firm bed Very central for all sights shops metro restaurants and bars would definitely stay here again ,good
 The room itself was a bit old The window did not close perfectly anymore with as a consequence that the noise and cold wind from the outside entered the room  Perfect location and a nice breakfast ,good
No Negative The fact the radio was on chill fm when we entered the room And the interior decor is painfully cool I loved the back lit round mirror in our room ,good
 Couldn t fill kettle under tap Bed was a little soft  Room was described as compact and was exactly that But enough room for bed bathroom and hospitality tray and TV Liked decaf coffee being present without having to ask for it Check in was very friendly Included Continental breakfast was perfectly adequate ,good
 I asked for a upper room but was given a basement room which had difficulties heating and had to keep calling front desk which they ve sorted out in the end  The room was clean and lovely for the price It also included a microwave which was bonus ,good
 Honestly The whole experience was great I definitely recommend the hotel My only thought here is it is probably cheaper to get breakfast at one of the nearby cafes than eat at the hotel  I love this hotel Upon check in the staff immediately greets you with a welcome glass of champagne and also gives you an overview of the city with recommendations on restaurants and attractions The rooms are great and pretty spacious The style is transitional modern and contemporary but still the character of an older building We were celebrating a special occasion so they gave us a bottle of champagne and chocholates in the room A great treat I really enjoyed the area of town as well It s not far from luxury shopping or the city centre and in walking distance to most local attractions The beach was under a 10 euro cab ride I definitely will be staying at this hotel when I come back to Barcelona ,good
 Bed wasn t particularly comfortable  Large modern and spacious rooms Fantastic gym large range of machines and equipment Pool and spa area great as well ,good
No Negative Lovely staff Superb pancakes for breakfast and real funky atmosphere in the lounge We loved it ,good
 Lousy internet Comfortable Clean and Central,good
 We booked for three adults room in addition to one doubl bed room However the extra bed was too small for 20 years old boy  Good location in Paris with outstandig service,good
No Negative Great service and great location,good
No Negative Easy check in nice quiet room with good furnishings ,good
 I didn t really like the breakfast there were no feta cheese or Philadelphia In the first day the guy who cooks the omelette was absent We had asked for double bed we were offered with two individual beds which were attached together  The hotel was very clean I care about the cleanliness of the bath room and it was spotlessly clean In the room the sheets were soft and clean everything was in order Internet was awesome ,good
 We liked everything Location was perfect for what we wanted it was very central close to River Thames and lots of transport links,good
No Negative Ideal location for the 02 Loved the Sky Ride over the Thames ,good
No Negative Concierge very friendly Staff at Reception were great Rooms were really clean n comfy,good
 Internet was very slow  Bed was very very comfortable and clean ,good
No Negative Excellent hotel great staff great location Will be our hotel of choice when staying in London ,good
 Rang 3x to order room service reception staff did not answer despite there being 2 sat on desk minutes before  Comfortable good size room,good
 Nothing in the mini bar and hotels always seem to be tight on the milk capsule provision  Very nice comfortable bedroom,good
 Bed Location Cleanliness Staff,good
 YOU SHOULD NOT HAVE YO ASK FOR THE TEA AND COFFEE FACILITIES AND INTERNET Breakfast was great,good
 Room was v hot  Lovely breakfast Absolute bargain at 1 a day Staff were fantastic so helpful Appreciated their excellent English language skills Beautiful clean room nice bar area Great central location Bonus to have pool sauna steam rooms but tiny ,good
 Only 1 chair  Very convenient location for getting around on public transport Good sized room with modern interior Room has coffee machine kettle and free cold water bottles in the fridge ,good
No Negative My daughter left her teddy bear and it was found and posted out the next day very stressful but the staff sorted it all out,good
 I was a little disappointed with the room Myself and my wife booked a double room but the room had two single beds pushed together When you moved on the bed the beds pushed apart and you d end up nearly falling inbetween the two  The location of the hotel was fantastic near the metro and the local railway The hotel is only a stone s throw from a whole host of sights There are plenty of restaurants littered around the hotel to suit any taste and budget The staff are friendly and the hotel is both clean and well presented ,good
No Negative We stayed in a double delux room It was very well equipped The bed was huge and very comfortable The room was very clean,good
 Still a bit of smell of new decoration Only have roof window Location is good to access important attractions Room and sheet is very ,good
 I really missed a gym and there was no headboard so sitting up in bed to read or watch tv was extremely uncomfortable  Loved the pillow spray and the room was cute ,good
 Smallish rooms limited breakfast buffet Amazing location,good
No Negative Pleasant staff lovely room pleasing d cor throughout There were nice touches such as iron and ironing board complementary toiletries and tea coffee and mineral water should you need them ,good
No Negative Staff location small but comfortable ,good
 The soft bed Everything is great Except for the bed It is super soft and cause back pain in the morning ,good
 The TV was at 90 degrees to the bed so you could not watch television unless you got up and got very close to the tv as small and sat in a chair  The breakfast was fine but not fantastic,good
No Negative Stunning view of bridge tower,good
No Negative Everything The staff are absolutely amazing The friendliest staff I ve met in a very long time Super helpful and nothing was too much trouble Would highly recommend for comfort beautiful rooms excellent toiletries premium location ,good
 No coffee So quiet Lovely,good
No Negative Location room facilities,good
No Negative Great breakfast choice fresh made omelettes with real eggs not a premix ,good
 Smokers ALWAYS blocking the entrance staff at breakfast take no care in the amount of noise they make when clearing tables and stacking them on trolleys it was over bearing also we came down to BF with 3 4 hr left to closure but the food selection was diminished and not refilled for 15 euro each not worth it  was chosen for proximity to main train station Staff courteous and efficient at front desk Rooms good size very comfy really appreciated the complementary water and soda ,good
No Negative Amazing views ,good
 The heating System  Very friendly and efficient staff The missing hair dryer was replaced within minutes ,good
No Negative Lovely helpful staff in great surroundings central to London Underground and 02 Great Stay,good
No Negative Absolutely fantastic hotel excellent customer service excellent cleanliness standards and excellent food All members of staff were amazing and the room was super comfortable and spacious Thank you ,good
 Unfortunately couldn t get a phone signal in the basement room a minor gripe  Excellent rooms and great location hard to beat in the area Continental breakfast very good ,good
 Rooms are quite small housekeeping sometimes forgets to top up the shampoo conditioner shower gel toilet paper  Location very central within walking distance to many shops and restaurants Staff are friendly and approachable Would stay again ,good
 Property and services where very good Location wasn t as good as I thought I originally searched for Leicster square London and this was the first property to come up not so good No Positive,good
No Negative Thank you for the Viennese birthday treat ,good
 No Very good location And Price,good
 Breakfast is very limited and not tasty Location availability of family and connected rooms receptionists and concierge are nice and helpful,good
No Negative Extremely friendly service A hotel that goes that extra mile to ensure you have an overall great experience,good
 Too few electricity outlets Athmosphere Staff Location History,good
 Room temperature We had to transfer to another room even  Customer Service is really friendly and very helpful on queries and support needed Even helped me find my lost luggage ,good
No Negative Staff on the reception were extremely helpful Location is brilliant and the bus from the airport stops just across the sq It was so easy Room was lovely and very clean ,good
 improved internet would have been handy  great breakfast selection,good
No Negative Having stayed at the hotel previously we requested a room on the top floor which we were given The breakfast that they offer on the 1st floor is very good always fresh croissants etc The beds and pillows are very comfortable as sometimes in hotels the beds tend to dip in the middle not in this hotel The location is excellent plenty of restaurants in the area the underground is 1 minutes walk away ,good
 Nothing It was a fantastic stay at superb small but exclusive property Great location lovely rooms and very helpful staff,good
 The room was small and rather shabby  The location was perfect Great for exploring Bloomsbury and very close to tube station ,good
 The rooms were small but we expected that its common in Paris  We choose this hotel due to its location price and recommendations and got exactly what we looked for located just on top of GARE DE L EST we were able to get anywhere fast Paris The rooms were new and pleasant to stay in The staff was remarkably nice and helpful Excellent value for money ,good
 Upon arrival the welcoming was great howvever you then go in to the reception area and found the staff a little bit rude Other than that great all around  Fabulous hotel Location is superb with fantastic views of Barcelona city Hotel provides everything you want for a great holiday The hotel kindly gave us a free birthday cake as this trip was on behalf of my girlfriends birthday found this really welcoming and respectful ,good
 the standard rooms are quite small and there is not much storage space  Friendly and very helpful staff small but very delicious breakfast buffet french cheese and ham selection fresh fruits fresh juices very comfortable bed Free Nespresso at the room great metro connection to the city center ,good
No Negative The hotel gave us upgrade in our rooms to city view that s wonderful ,good
 The Wi Fi on the 4th floor was rather spotty and tended to kick out more frequently than I would have liked It was usually resolved after disconnecting and reconnecting every so often but it made using the laptop just more cumbersome than strictly necessary  We were awed by their attention to detail uniqueness of each room tastefulness of decoration and above all their 100 dedication to sustainability For example the hotel generates a huge percentage of their electricity through solar panels in downtown Vienna no less Every bite of food is organic and locally sourced or produced in house Strictly Fair Trade Tea and coffee are even imported by a CO2 emission free sail ship http fairtransport eu ships tres hombres Staff was very attentive at all times from early mornings to late at night and unwavering accommodating It goes to show that you can successfully operate a business and be environmentally conscious and maintain a good relationship with your staff and guests Great example and impressive ,good
 light duvet duvets very light and cold,good
 Waiting more than 2 hours to check in more than 2 hours to clean and prepare the room Disappointed No Positive,good
 Room not being available on arrival and lighting in room not bright enough for my wife to apply her makeup Club lounge,good
No Negative Every thing,good
 There was no view TV was not facing the bed or the sofa got slight stiff neck Staff were very accomdating I wasn t well on my trip and felt staff couldn t do anymore than they did to make me as comfortable as possible ,good
 ROOM HAD A KINDA TOILET SMELL WE ASKED TO BE SPRAYED AND MAYBE WAS BUT STILL SMELLY STAFF NUMEROUS AND ENTHUSIASTIC BREAKFAST REASOABLE PRICE,good
No Negative This hotel is quiet private and chic If you like the feeling of privacy in a beautiful place and a cool neighborhood this is the hotel for you This is not one of those grand hotels and so the hallways are a bit too narrow and some of the rooms are not as great as others I think this all adds to the charm of the place and the sense of history The staff was friendly and helpful Even the ladies who cleaned the rooms were sweet Don t miss out on having breakfast in the 2 beautiful rooms downstairs Really a treat This was our 2nd time there and we were upgraded to a family suite which was a wonderful surprise We were 3 and had 2 bedrooms a living room and 2 bathrooms It was for us a very memorable stay ,good
No Negative Hotel is in a great location having the metro station around 6 mins away walking through the park The room was very clean the staff were more than helpful The restaurant staff are very polite too Didn t have one single complaint Only a few stops away from the main shopping areas by metro The whole journey will take less than 10 mins Recommended Hotel A ,good
 The room was small but to be expected for London had everything you needed  Great location,good
No Negative Great location for theatres and lively Soho area,good
No Negative 30 seconds from Las Ramblas easy reach of everywhere very good ,good
 N A Eveything was just perfect,good
No Negative Fantastic variety of breakfast Staffs are young but very well trained and friendly ,good
No Negative The breakfast was great And the gym superb ,good
No Negative Helpful staff Efficient handling of demand for breakfast ,good
No Negative The bed was incredibly soft as well as the shower Staff was super friendly and welcoming and the hotel is basically across Leidseplein and within walking distance of many restaurants and the nightlife scene in Amsterdam as well as close to the museum area and to the Heineken Experience ,good
 No This was my favourite hotel we stayed in on our recent trip Europe Location was perfect Room comfortable and clean Loved the atmosphere created by colors and the artistic murals on the wall Staff were incredibly helpful and friendly Would definitely stay at this hotel again,good
 Walls are too thin you could hear noise in the hallway Also if your on a lower floor you can hear at 7 am the garbage truck from our room No Positive,good
 The cleaness of room shower power For a short stay the location hotel type is excellent,good
 The mini bar selection is not that great They can do better Not enough number of umbrellas for the guests  Excellent location very polite and willing to assist staff members The manager of the hotel is doing a great job with the staff,good
 Nothing Good all round service,good
 The fact that we could not stay longer  Staff made our stay special as it was a special occasion that we were there Beds were extremely comfortable rooms were spotless with lovely touches throughout ,good
 Quite cool in the reception area needs heating or an open fire to compliment the building No hot water for a shower on the evening or the following morning staff were very very good and issue with the above was resolved but put a dampener on the trip  Location in a quiet street location to the tube and local shops,good
 The only grumble is no on site parking can t be helped with the location but offering the NCP parking facilities is a lot cheaper and closer to the hotel  The staff were so friendly and the hotel itself was simply amazing We stayed in an executive room so had access to the lounge again just made us feel extra special Top hotel we will definitely be staying again,good
 Rooms facing the front are very noisy  Location is great Restaurant very good and price very reasonable Restaurant manager and staff are very friendly and professional ,good
 We were not able to access our room until 16 45 but the reception staff did offer free drinks etc by way of apology  Stunning location beautiful hotel Breakfast was amazing with everything you could think of The staff were friendly rooms were clean and the beds were very comfortable We had an amazing river view balcony the view from our room room 441 at night was beautiful The only negative I had was the check in we were supposed to be able to check in at 15 00 but our was not ready until 16 45 this was a bit of a let down but we were given2 lots of drinks vouchers and later that evening a complimentary fruit bowl and drinks I would definitely book this hotel again ,good
No Negative The location was just perfect and I loved the cool look of the hotel with all the different lighting throughout Rooms were excellent with very comfortable beds and staff were always friendly and helpful ,good
No Negative Helpfull competent staff Great location ,good
 bar doesn t work during morning room was quiet excellent breakfast excellent location,good
 Fire alarm testing on a Sunday without any prior intimation Could lead to panic attacks or worse for people of that disposition Everything Efficient businesslike,good
 No hot water in the mornings for 2 days and the Hotel could do little to help us The friendly staff the location and the buzz in the Hotel ,good
 cant say much Rooms were very comfortable and the service from the staff was brilliant Plus the location is dead set center to everything,good
 The price for Christmas Dinner was a little high  Stayed for Christmas and could not fault a thing with the hotel itself Service was amazing staff superb and overall a brilliant stay ,good
No Negative Wonderful place,good
 No bath robe Comfy bed,good
 Room was quite basic in comparison to the overall hotel No coffee making facilities in the room  Staff were very helpful I asked for some complicated directions to more than one place and the young lady was very patient and gave me lots of her time Thank you ,good
No Negative Great staff good location good rooms ,good
 Consumer Furniture cleaness Free wifi,good
 Nill I did like the service i had alot every one was treating me like a family they never ignored my request and when ever i ask for any thing i find it right away at my door step so thanks for that,good
 They did not have connecting rooms As we are a family of 5 with a 11yo 8yo and 5yo we had book 2 rooms The rooms were on the same floor  Location was great Walking distance to metro city tour bus stop and Ramblas Street ,good
 As mentioned the hotel lies in between two derelict buildings in a largely residential location We were travelling with an infant and required a kettle which took over 24 hours to arrive despite repeated requests  The hotel was very nice Room was large and breakfast was good Value for money was superb 10 minute walk to the underground train station Free parking ,good
 Nothing Good quality of food attentive service from staff,good
 Everything was perfect Great hotel ,good
No Negative Excellent hotel Highly reccomend,good
No Negative Everything was amazing from staff to room and location was perfect ,good
 room sizes staff,good
No Negative The staff were extremely helpful and welcoming,good
 Nothing  Staff were very friendly and helpful and went out of their way to help us with booking tickets restaurants etc They also allowed us to use a shower at the end off a hot day before we took a taxi to the airport ,good
No Negative Did not have breakfast,good
 The card in the bathroom mentioned a lot of complimentary items such as razor shaving gel comb etc however we never saw them in the bathroom this was not a major problem since we had our stuff with us anyway yet I wonder why the management offered something when they didn t provide it The room had only two bath towels which is a bit difficult to deal with when one of the guests has long hair and thus needs two towels herself The management really ought to put in a couple of extra towels in the wardrobe  The hotel is close enough but not too close to Kings Cross and the Euston Road artery You can be in central London Russel Square Victoria station Covent Garden etc within 20 30 mins on the Northern line and the buses I agree that they are slower nevertheless they are more comfortable since you don t have to breathe in the bottled air and stand in a crowded tube can take you there too Angel has excellent cafes pubs and restaurants We had all the meals there There are many shops and the normal brands of supermarket and a proper market Chapel Street St Mary s and St Silas s churches and Sadlers well theatre are nearby Buses 207 73 and 30 stop right next to the hotel Angel tube is a few minutes walk away Check in and check out were smooth The room was spacious for London clean and tidy and the soundproofing was excellent Proper controllable AC was present in the room Excellent staff gave us all the time when we took a extra time to check out They also have 24 hour manned front desk we came back in the wee hours of the morning D ,good
No Negative amazing hotel great location and lovely staff,good
 No tea and coffee facilities in the bedroomNo Positive,good
No Negative The personnel is extremely kind and will always assist you The hotel is easy to find and you are at the Central Station in 5 minutes Easy to access all points of interest Superior rooms are quite modern very comfortable and worth the price ,good
 Not somewhere where I d like to spend time but a good place to crash for the night  Everything was right with the room bed was comfy and the marble lobby quite a sight for tired eyes ,good
No Negative Great price excellent facilities and easy access to town center ,good
 The view from the room windows  Executive Family room was very nice and comfortable ,good
No Negative ted close to all amenities Metro shops cafes Opening windows was a bonus ,good
No Negative Great location Tucked away on a quite street yet only a few mins walk to the centre of town Dam Square,good
 Room rate is expense Staff location is nice,good
No Negative Well equiped Staff friendly Close to padington station Nice room,good
 wifi Lovely room great location very good shower ,good
 THE ONLY THING I WOULD RECOMMEND IS A HANDLE TO HOLD ONTO WHEN YOU ARE ENTERING THE SHOWER IT ALSO COMES HANDY WHEN YOU USE THE SOAP AND THE BOTTOM OF THE SHOWER STALL GETS VERY SLEEPERY THERE IS NOTHING TO GRAB TO BE SURE YOU ARE NOT GOING TO FALL  The croissants were extra flaky outstanding the staff especially FRAU DAGMAR NIEL FANTASTIC EXTREMLY FRIENDLY AND HELPFULL BRAVO FRAU DAGMAR NIEL HOTEL ROOM WAS VERY NICE AND COMFORTABLE ,good
 Nothing The fact that it was clean within walking distance of the tube ,good
No Negative Diego and all the staff at the hotel The Serras are an absolute delight The level of service they delivered constantly was exceptional across the board Food and wine at the hotel was outstanding cocktails at the rooftop bar oh how we miss them I can whole heartedly recommend the hotel The Serras to any one visiting the beautiful city of Barcelona P S Check out De Antonio yachts ask in the hotel we chartered a boat with them to watch the sunset over the city sky line which was an awesome experience the perfect end to our trip ,good
No Negative Quality breakfast which didnt close early plenty of choice Staff friendly and multi lingual ,good
No Negative Great location and world class customer service ,good
 I felt that the prices in the restaurant were high My reason for coming was sad and personal I chose this hotel because of its link with Paddington because I was On my own ,good
 rooms bit small but ok stylish funny very nice and friendly always helpful especially considering London average prices this is the perfect choice check out the Borough Market very close you will love it,good
No Negative Excellent place to stay ,good
 Nothing Our second stay here and we ll be back Really friendly helpful staff just as we found on our first visit Brilliant location nr Earl s Court tube and some great eating spots within easy distance The front of house team were especially kind and helpful Keep up the good work and see you next time ,good
