review,classification
 The chefs in the manhatton grill ate dinner but didn t bother staying for breakfast didn t want to chance it after seeing how they perform Being given a suite after complaining about dirty room,bad
 Booked to stay at this hotel because it has air conditioning for a long bank holiday weekend On both of the days of our stay it wasn t working Our room for most of the day and night was nearly 30 degrees Its fair to say we did not have a good weekend in London  Staff ran an excellent breakfast service ,bad
 No drawers and very small place with 5 hangars to place your clothes The room was not clean properly Clean when we vit there the other 5 days was not needed to Ask for body soap toilettes paper the y gave you only two kleenex in a plastic bag if you asked ,bad
 I paid almost 400 GBP for a very small room expecting that I will have a quite sleep as my plane was early in the morning There was a baby crying all night next to my room and I could not sleep at all The walls were so think I could hear all conversation and the crying I complained in the morning to the person in the reception and her answer was I am sorry I know that the walls are thin So why do yo charge so much money then No Positive,bad
 Except 2 everything is BAD i feel only by looking its 4 star hotel but not functioning Wifi is horrible and when i complain the guy asking me to go down and use the net temperature in the room is horrible its like staying in the oven when i complain about this he is asking me to open the window why the hell they are maintaining AC in the hotel and when we open the window whole night trains are passing through your window and feel like you are sleeping beside railway track I totally not recommend to this hotel  The room was very clean and breakfast is good ,bad
 Most of the things Old building They charge for every small thing They charge for sitting in the lobby after the check out to wait for a taxi Staff are not very friendly I don t know why my rating was calculated as 2 9 10 The reality is it is way below average It should be 1 5 10No Positive,bad
 I forgot my gold jewellery in the safe in the hotel room and contacted the hotel as soon as I got back Fortunately the hotel had found them and agreed to send it to us by express mail if we pay for the charges which we happily did When the jewelries arrived we were shocked to discover all gold pieces were missing and the other jewelries were sent to us We informed the hotel but neither the hotel nor the courier MBE and UPS takes responsibility for the missing pieces and tell us off by pointing at each other Although a nice hotel we are deeply disappointed in our experience with this hotel and would never go back NOT RECOMMENDED Nice room and lobby,bad
 I was charged twice once on my credit card and again in cash on the day I was told my card would be refunded still waiting Wont use Hotel or booking com againNo Positive,bad
 Everything Nothing,bad
 The room was too small the cleaning was not done properly the mattress was horrible there was no fridge bathroom seat was broken and what a miserable elevator No Positive,bad
 Poor bad place Nothing,bad
 Everything needs to be renew Staff unfriendly Durty Phone did not work Reception at arrival awfull Only the location ,bad
 our shower was leaking after report a problem reception send a maintenance who didn t fixed the problem it was still this same when i wanted to change a room i hear that they are totally full booked and they cannot do anything so i asked about new extra towels coz all of ours was on a floor to try keep it dry after all when i was going to check us out receptionist was extremely rude she even didn t say for us goodbye i do not recommend to stay in this hotel  nice and friendly stuff on a breakfast ,bad
 Very disappointed with everything Definitely not worth a 4 hotelNo Positive,bad
 The hotel d cor is old and tired and could do with refurbishing The place is not the cleanest The price seems a little steep for what is on offer Would not recommend if you are looking for a quiet place as many of the guests seem oblivious of others and go about noisily in the corridors late at night or slam doors No Positive,bad
 Far from metro M5 at the edge of town bus 80 from Quinta Romano everything with charge and expensive breakfast is not diversified and poor in vegetables the personnel has a voice on tourists quickly cleans the table even if you have not finished eating 4 star comfort is not like in other countries From Malpensa airport express bus stops at Fiera Milano City Viale Teodorico near the subway station Portello violet M5 line take it to San Siro Stadio No Positive,bad
 Unhelpful staff and Manager No room service availability unmanned reception telephone Location was good ,bad
 accomadation Staff Service Poor quality of room None claustrophobic room Poor service at breakfast,bad
 Location miles from airport ld never have found it without satnav Rooms very dated and sad  Large rooms,bad
 location is not as good as perceived Staff are rude  i thought it was good price but it wasnt,bad
 Staff are very rude Issued the wrong from firstly I had requested a superior double room and was issued a small twin room I contacted reception who was rude they then moved me to a double room Which again was not a superior size as I had previously stayed at this hotel 3 weeks prior and was given a SUPERIOR room This stay was for two nights and the room was extremely smaller The staff response was we are fully booked Which was not the correct response I was looking for as this added to my doubt that I was in a smaller room then I had paid booked After being told by the receptionist we could use a specific door to exit into the gardens to smoke we was rudely told by another member of staff that we could not That the receptionist was wrong or she had not told us that we could use such door and we need to go to the front of the building Considering we are on the 3rd floor this is an extremely long walk No Positive,bad
 over all standards of 5 starts hotels loction,bad
 No bar no restaurant very poor only one person reception no a 4 starNo Positive,bad
 Breskfast location towels nd size of the room Crossants were tiny too  Butter jam and shampoo,bad
 My phone went missing from my room whilst on charge And when I asked the staff about it the pretty much refused responsibility for it Location was ok,bad
 Worst stay in Vienna ever No Positive,bad
 Everything else  Location only ,bad
 This hotel is rated at 4 star it deserves only at 2 3 star It s an old building with old design and old furniture even an old safe which requires EUR25 for a key deposit No fridge and no coffee maker only 1 staff working at front desk no restaurant poor breakfast menu which costs extra We booked this hotel because we trust the rating on Booking com the rating is flawed and the rate is a rip off I will report to appropriate travelling agency about this flawed rating which lures unsuspecting travellers to this facility We come expecting a 4 star hotel and left totally disappointed  Except for the location nothing else ,bad
 Air condotion very low and Wifi dosnt work perfectly breacfast was good,bad
No Negative Nothing,bad
 The Internet was not working in the room There was no way to regulate the heating It took us 1 hour to check in There was one staff on reception dealing with a big group and wait of an hour that we could have used for sight seeing The phone to the reception did not work so we had to go down everytime we had a problem We were told to try the internet every few mins which didnt work and each time to report it it was a trip down to reception We stayed 3 nights and each day the staff promised it would be fixed but no one did anything We had booked it non refundable otherwise we would have moved hotels Could do without the hassle when travelling and planning our trip No Positive,bad
 the staffs are not co operative no politeness and helping nature even after paying 350 euro per night no good hospitality No Positive,bad
 Rooms no longer available because arrived at midnight Unbelievable Booking took money by the way Staff not willing to help and living us outside at midnight No Positive,bad
 Staff in the reception I hate how the talk with us they are not helpful only because I don t want to upgrade my room they give me bad room for single and we r two people Location,bad
 the behavior of the reception staff unwillingness no help arrogance haughtiness and unfortunately differentiated approach to gender No Positive,bad
 Very poor service not safe to stay staff are very rude to customers room is in poor condition never go there ever again No Positive,bad
 Dirty room Place was good,bad
 This is not a 4 star hotel 1 star b b would be pushing it totally deceptive photos will stay at the Hilton next time considering it s the same price  Nothing ,bad
 Lifts not working Poor breakfast Very narrow staircase Reception in the restaurant Bizzare No Positive,bad
 The rate too expensive if we compare it whith their services  The staf not smiley The staf very very poor And they gave us feeling like we are animes,bad
 I found a mouse In My room And got Sick some kind of poisoning And the hotel couldn t care less about what happens as soon as left the hotel they started with emails about proof and not being possible Don t recommend at all No Positive,bad
 I thought I had booked the hotel near the Tower of London so was disappointed when we arrived The hotel location was quite a distance from any sightseeing places and with the ferry that takes you across the river finishing at midnight we felt like we were on a curfew Our rooms felt like loft conversions with slanted ceilings not great with a 6 4 husband and you could feel and even hear the springs in the mattress so no sleep for all the wrong reasons Our alarm went off on the final evening of our stay with no explanation whatsoever To top it all off the towel rail was positioned behind the bathroom door so sprang back every time you opened the door causing injury on the last day to my arm  The breakfast here was lovely and the rooms were clean ,bad
 the standard room was awfully small for 2 people but on description it says for 2 people we barely could fit 2 suitcases and the sink was too small the room doesn t have a window No Positive,bad
 Our room was at the end of the hall and the wifi was not working at all None of our devices were able to connect since the signal was too weak Had I known this before I would have never booked this hotel The staff members didn t seem to care much about this and always lied about how they never had this problem before They offered us to switch rooms but the next day when I came down to do it they were always full I had to go down to the lobby to use the wifi which was a real inconvenience  Nothing,bad
 No wifi the first day and staff could not help to make it better Location was actually further than expected from the Arch of triumph That hotel took the initiative to upgrade our room following the wifi problem,bad
 Hater ukjente fixe ekstrabetalinger Hate unknown ekstra COSTs claimed at check out 4 stars maybe 20 years agoNo Positive,bad
 Very rude so didn t check in and just left after cancelling my booking  Nothing,bad
 The parking facility is a pighole The staff is sneaky and lazy  The interior design of the hotel is nice ,bad
 Very dirhyyyyy Location,bad
 Bad breakfast bad bed badly marked bathroom needs renovation no shampoo  Nothing,bad
 The photographs displayed when booking makes the place look nice and modern however the rooms do not look like the photos and we had a hideous 80 s looking room I did not feel comfortable sleeping in this hotel that I did not even sleep in the bed I decided to pass out for 30 minutes on the tiny table whilst hanging my bottom off the end of the seat that was provided as you can imagine it wasn t comfortable doing this but I had no choice After being mislead I did not trust the cleanliness of the hotel and ended up leaving the hotel at 6am so I could go home and get some sleep I asked the receptionist to get the manager to give me and my partner a call as they were not in when we left but we still haven t received a call and we want a full refund for the horrendous night we had at this hotel The hotel is very confusing as well and didn t help the confusion with a wedding going on  Nothing ,bad
 Very dirty Mold all over bath tub Towels are one set for two guests I have to ask for second face towel Carpet diary soiled Customer service very rude Management was not there to complain One of my group was with us given a duplicate key for a room was already occupied they open the door on a couple were in bed Just breakfast buffet but we paid for it it was not completely with the stay,bad
 Everything room size location dirty rooms and bathrooms  Nothing at all,bad
 The service wasn t very good asked for pillows repeatedly didn t come room was not very clean bathroom extractor yuk no valances on the bed bases which were dirty holes in the walls cracks in the tiles tired furniture worn carpets etc  The parking outside is free on Sunday s,bad
 Long list Location,bad
 The staff didn t care about the customers taken for granted My partner and I got fleas from the bed clothes Everything was overpriced Never again ,bad
 Truth and return my money back I am not happy because the hotel dosnt have air conditioning they have renovation the hotel so I Am very upset about booking com if you know that and not tell me about it and these hotel account me tow time with out any reason so you have to process the management very well and call or contact me to justify the problem I have thanks,bad
 The problem has happened both times we stayed at the property hot water goes of in the middle of the night so in the morning it s a freezing shower also water completely turns off throughout the day around 2 3 times for 3 4 hours which means no water to use for making tea washing your face a the odd shower someone wants in the day all these are not possible Please check that the pillow covers have definitely been changed when you inspect them carefully you can see the hair gel the wax and in my experience some blood which I found when I turned the pillow over asking the reception to changes these is a night mare as they have the classical hotel excuse of cleaners are only available in the mornings sir No fridge very dusty the cleaners literally clean it so quick that upon a glance it looks clean but when you spend 5 minutes you can see how dirty the place really is not recommendable at all  It has a nice location of course being in Canary Wharf ,bad
 No aircon No Positive,bad
 The room breakfast the receptionist Nothing,bad
 Hotel Miles away from where we wanted thanks to booking com The oppwrsite side to London that I wanted Are booking Com only offering certain hotels as they get more money First room cramped twin beds small no bedside cabnets on one bed damp showing on celling Cord too short on kettle Spot lights on wall outside Second bedroom stairs upto bathroom not ideal bed extremely poor very uncomfortable Parking is for only two cars in a back yard I only have a medium size car and was hard to get in and out only 1 inch either side trip items like hovers left in a tight hall way Lift only to floor 3 Had better facilities in a travelodge Not what I would expect in a four star hotel Staff were great very helpful and friendly 10 out of 10 for that No charge for blue badge parking great ,bad
 Everything Nothing,bad
 Toilet flush didn t work we had to use the shower to flush air condition was as noizy as an average Boeing so impossible to use at night only 1 towel in a 2 person room Large room,bad
 Blocked toilet Dirty room  Location,bad
 Paper cups in a superior room no iron in the room uncomfortable bed and charged 10 to purchase a adapted plug I have stayed in many hotels and none have ever charged just lent these to me Very disappointed Modern reception area,bad
 Housekeeping awful Location,bad
 Very poor service wifi almost none exists breakfast not attractive at all  Location is not bad ,bad
 The Room was realy too small not confortable  Clean,bad
 worst experience ever Never going to use any of the hotel in this group not worth a try at all  nothing,bad
 No ac Travel with a 6 month old baby and was suffering our entire stay It was 37 degrees and no ac in the room No fan no help from stuff when we complain Horrible Location was good,bad
 Door can not complete closed rooms also relatively small staff not friendlyNo Positive,bad
 Everything Found comdom in my room room was not to its best condition was not happy,bad
 There was a dripping tap in the sink The shower basin filled up and did not drain easily Some of the switches and electricity plugs were not secure No Positive,bad
 Everything was poor Very uncomfortable beds They gave us a room with one bed when we checked in but we were a family of three Our teenager daughter was with us the purpose of this trip to celebrate her birthday I had to fight on a different room That was a bad start for us No Positive,bad
 room breakfast cleanlinessNo Positive,bad
 Rude personnel Personnel gave us a wrong room Did not want to admit their fault Trying to seem like we were wrong Finally when another colleague came we did get the correct room No apologies were made When we mentioned that the other colleague was rude We were told we were liars To get to the elevator you first have to use stairs Very inconvenient to be climbing stairs with your suitcases Also no hotelstaff offered to help with luggage We had to do it all by outself  Rooms were clean,bad
 Black mould in the bathroom the bathroom facilities were quite dated and needed to be refurbished with quite a lot of dirt between the tiles Disappointed with the lack of cleanliness of the bathroom for a four star hotel The view from our window was a graveyard which although is not the worst thing in the world I would expect a bit a clarity that was a possibility when booking your stay Our major gripe was the poor service provided by the reception staff who were generally not helpful had absolutely no common sense and could not comprehend the concept of good communication or customer service The s standard response that was given to everybody with a request or a complaint was I will have to ask the manager After taking payment upon our arrival which we assumed was payment for our accommodation we were informed on check out this was in fact not the required payment for the room and we had to make another payment for the room The receptionist decide to cancel my previous transaction and request full payment rather than charge me the outstanding 8 Due to this I am currently unable to access to the initial payment of 200 as it is still allocated or within a shadow by my credit card provider Overall we were generally disappointed with our stay No Positive,bad
 Terrible lifts breakfast in the exec club very good,bad
 The TV and phone in my room was not working Despite several complain the hotel choose to ignore I end up changing my hotel for the rest of my stay No Positive,bad
 Poor service TV reception was very poorly tuned in Old worn out feel to decor furnishings Location was pretty good,bad
 Poor service no water no kettle no Iron no coffee Tea powder kept asking them but no one bother to help over all worst hotel i even stayed Nothing,bad
 I would never recommend anyone to stay in this hotel 1 Staff 0 knowledge and they never know how to charge the Pre authorization amount 2 for on shift supervisor i am going to complaint and escalate her to there higher management so that next time she wouldn t behave such behavior with anyone else and let management to give her some training about hotels 3 room are very very very very small you cant ever walk in the room 4 charging high price with 0 service 5 NEVER RECOMMEND TO ANYONE  Nothing to like in this hotel ,bad
 Not a friendly welcoming at check in Got a room with very thin walls and a drunk arguing and partying couple next door that was very noisy between midnight and 7 o clock in the morning This ruined my sleep completely Breakfasts the next morning was also a disappointment when it comes to the quality of what was served Overall one of the worst hotel experiences I ve ever had No Positive,bad
 Stuff are careless there forcing us to solve their problems with lack of cash in 6 a m while we we in a hurry to the airport Room was very dusty and furniture seemed to be quite old and rugged Wi Fi speed was also low  Only thing we liked is the appartment view on the city ,bad
 Staff very poor in service No blankets at the hotel we slept with only sheetes to cover the kids Requested during the two nights but the answer that they don t have it I had a nother reservation at the same location which thankfully I cancelled  Location only,bad
 Client can t turn off air conditioner the other one is very tall but taken to a room with small bed fell down to ground in the deep sleep Their bathrooms are not clean enough to stay compared with their past experiences in Hilton Said would send a solving e mail to us haven t received until now No Positive,bad
 Everything Nothing,bad
 The think size bed was very small and the room dirtyNo Positive,bad
 I was told there s no room for me after confirmed my resevation a day before Even you have my contact no email no phonecall nothing How would you like if you travel one hours train and half hour taxi only want to rest and when you arrive your hotel no room Are you just expecting me enjoy the way you welcome and enjoy your happy culture Thank you for paying a taxi to take me to another hotel but this wont make me comfortable anymore Hope you can do better No Positive,bad
 LocationNo Positive,bad
 Electrics dangerous in our roomNo Positive,bad
 Any possibility to speak with the management to ask if is possible change the date was a nightmare on the phone Was very unprofessional the receptionist to my question to change for the day after just look to keep the money no mattered if I mistake the reservation day just stolen money the hotel with no possibility to change for the day after never more,bad
 It s run down needs to be totally refurbished and its dirty it s a disgrace maybe it was 4 10years ago but now it s 2 at best Booking com should not be selling it as 4 Hotel it s a disgrace to your company too if I could rate it lower I would  There is nothing about this hotel I liked,bad
 20 mins of free Internet in such a developed country is a shame Poor breakfast plastic apples Dirty carpet no slippers offered Plug adapters for GBP5No Positive,bad
 When I arrived late in the evening they just told me they had given away the room put me into a taxi and sent me to another bad hotel in another part of town where I did not want to be but only after they forced me to pay the invoice for the room which I never saw which I had to accept because I did not have anywhere else to go They had my phone number and e mail so they could have asked me at any time if I were going to show up which by the way I always did every single time I booked there since I have an important client just mext door but they did not After very little sleep I had to get up earlier the next day and take a taxi which I obviously had to pay for myself to reach my client where I spent the rest of the day fighting against headaches and exhaustion courtesy of this appalling establishment  Nothing,bad
 Noise from trains in rooms at rear of hotel  Good location Great staff,bad
 The location was terrible and meant so much travel to get to any of the nice areas Unfortunately our room was very uncomfortable with a bad bed and pillows a smell from the air conditioning and was very small and dingy for over 125 night The worst part was the terrible value for money one of the worst hotels I ve stayed in for this Had a beautiful hotel in Girona the week after which was a fraction of the price but which gave such attention to the guests and their comfort unlike the Senator  They had an ice dispenser on our floor and a minibar of complementary drinks ,bad
 Old musty smell and outdated carpets dirty bed sheets and dirty rusty bathroom Everything in the room was so worn it looks like it hasn t been replaced in 30 years  Very outdated horrible not even worth 2 ,bad
 All Nothing ,bad
 bathroom and room very basic not 4 equivalent good location,bad
 We were surprised to see bed n breakfast like service in such a big hotel brand and costly too There was no room service Even we need to go and buy water bottle also from Reception area At least a vending machine would have given the feel of descent bed n breakfast hotel but they were shamelessly selling the water bottles also from Reception Breakfast was also too simple Not worth spending so much money for just a brand Similarly Clean bed n breakfast would be available at fraction of cost No Positive,bad
 The elevators were not working We were so dissapointed We do not expect that from this chain of hotels So we had to cancel our reservation and stay at another property  Nothing,bad
 I arrived late to be told had an upgrade to a room with a king size bed after the worlds slowest check in I opened my room door to find two twin beds I phoned reception to ask to be moved to a room with a double bed that I had booked Reception informed they had no more rooms available however they would make my twin beds into a double The lady on reception and a waiter arrived to make the bed It took them 45 minutes meaning I didn t get into my room until 10 30pm a night Check out was incredibly slow the lady on the desk took around 15 minutes to check people out  Not a lot bathroom was clean friendly barman,bad
 It has a bed nothing more Not much,bad
