review,classification
 Bathroom and toilet was without any separating to avoid spilling water in floor It was near metro station and it was likely,neutral
 The minibar was empty and did not work as fridge how is it possible to call a room King Deluxe and not have a fridge I only received 2 water bottles for the entire stay The elevator motor sound in the room close to the elevator on 21st floor room 2104 was very disturbing No Positive,neutral
 We booked a deluxe room and got put in a broom cupboard Had to fight to get upgraded out of it at 12 30pm when we arrived without being forced to pay for an upgrade Generally check in staff doing Late shift are pretty unpleasant Pool tiny Few facilities or service that make you feel that you re in a 5 star hotel Beautifully designed bar and breakfast room on first floor Restaurant staff very helpful Cosy outdoor terrace ,neutral
 The restaurant in particular the rooms and reception are extremely dated The gym facilities are abysmal and the 7 00 charge is ridiculous for its use  Location and the building itself ,neutral
 The rooms our old and dated with stained carpeting There was only one hook to hang our wet towels after a shower concierge booked a trip to stone henge for us and the bus ended up dumping us off on the other side of the city where we had to pay 25 Euro to get back to our hotel I complained to the concierge and they said someone would contact me It has been almost a month and no one has  The staff was friendly and helpful The lobby was very nice and updated I also liked the location as it is walking distance to Starbucks and the British Museum,neutral
 There are no drawers or shelves in the room on which to place clothes etc for my 9 day stay though the hotel helped out by bringing some shelves I was surprised at the sudden hike in room charge for Friday Saturday even though I stayed for 9 days  Location breakfast general mood inside the hotel,neutral
 On entering our initial room there was a wet stain on the carpet We were moved to another room on request  Well located Clean communal areas Decent budget hotel ,neutral
 Reception desk consierge have not yet learned that they need to treat all clients alike Cleanness is a major Isuse Saturday 14 11 after repeated inquiries on my part they finally managed to perform the daily room cleaning at 14 30 The internet kept disconnecting for no apparent reason All the above and perhaps others that l may omitted justify the reduced numbers of guest at the hotel No Positive,neutral
 Too far from Central London suspect a hostel next door as someone sleeping on a bench Worst of all the room was WAY too small Staff were good although possibly a little over friendly ,neutral
 could be more activities not just pool good location and quiet,neutral
 As above Same breakfast always no really variety Bed very uncomfortable in the deluxe twin room room tiny car park lift useless Evening meal atrocious ,neutral
 The entrance is quite grand but when you go to the room it s very dated Beds are not that comfortable I prefer the premier inn beds I liked the pool facilities,neutral
 Understaffed Very basic no frills hotel Nothing to write home about Clean basic,neutral
 The staff where so unhelpful telly broken complimentary drinks half drunk staff couldn t have cared less Very disappointed and I m not normally one to complain No Positive,neutral
 Window screwed closed Good breakfast,neutral
No Negative Not bad,neutral
No Negative Good location Typical conference hotel,neutral
 Location of room sizeNo Positive,neutral
 The reception staff never there had to wait for so long and when someone is there they re quite rude no smile no eye contact Asked for an iron many time many occasions but never received one So I had to wear my creased clothes We ve payed for the breakfast but we only had it once as it very poor quality there s barely anything to eat Very disappointed,neutral
 the room was advertised as having an extra large king bed This was actually 2 single beds pushed together with 2 duvets so was not at all comfortable  The location is excellent Across the road from the Edgware Road station and about a 20 minute walk from Marble Arch and Oxford Street,neutral
 Room given was horrid and cold was moved to another room which was better but the tv did not work I was told maintenance would come up but noone came  Room was clean location was good,neutral
 Rooms Rooms r small and expensive but location is ok ,neutral
 Room too small and cold Too expensive for what is is  Great location ,neutral
 Was put in a basement room very cold and at front of hotel onto street Noisy due to trams and people walking by all night Shower door didn t close properly mini bar cabinet door didn t close properly Room just felt a bit run down All in all disappointing stay here whenever i m in Amsterdam and always been impressed but fell short this time Will stay again but will insist I don t get a basement room  Staff great good location dinner great ,neutral
 No complaints convenient location on the underground from Heathrow didn t have to change trains ,neutral
 When checking in we were given a wrong room which was already occupied Locally noone was inside the room but what would happen if we had walked in while someone was there Plus it made us wonder if they could so the same and give our room by mistake to other guest and we get a surprive random visit Unacceptable  Location was good,neutral
 Not able to make eggs over medium chef insist that a single sided fried egg is the same No Positive,neutral
 Staff was extremely rude and not helpful No Positive,neutral
 The location was not as central as described The wifi in the bedrooms was not free The rooms very basic and too hot The shower leaked flooding the bathroom  The staff were helpful and friendly,neutral
 The staff does not have enough knowledge on touristic areas within Barcelona They are not flexible enough and too slow In other words they are NOT helpful whether it s regarding to your hotel service system taxi to anything about Barcelona It s a five start hotel but definitely not worth four stars  The bed and the view was nice,neutral
 The services in general was not good The breakfast is excellent The room size is very good for a family Near to metro station,neutral
 Poor facilities bathroom was a mess cracked tiles dirty marks in bath housekeeping not to a high standard sheets didn t get changed bath wasn t clean booked a superior queen size room and it looked like an average 3 room  Good location,neutral
 Bathroom too compact bath scary  Bed comfy roomsmall asked for fridge completely covered in dust,neutral
 room toilet was dirty and they recomend only one restaurant to everyone which is a tourist trap location,neutral
 The rooms where old The location and the staff,neutral
 Poor service staff don t speak much English shabby or tacky corridors too expensive for what you get There s nothing much to like about this place apart from the location 5 star prices for a 2 star hotel ,neutral
 Service not good Location,neutral
 The bed was very uncomfortable No Positive,neutral
 too bad hotel service cause I lost one Hermes belt in my room and the housekeeper said not find it so nobody try to sort the problem if every body lost things in room and the hotel can not keep customer staff safe why we live there To TerribleNo Positive,neutral
 The room was not well cleaned every day There was quite a bit dirt and hair and dust on the floor There was also no carpet in the room so it was a little cold to walk bearfoot There were no tea or coffee making facilities in the room either Had to get a kettle and give a deposit at reception Then had to get mugs from the bar These were not cleaned every day and left dirty so we had to clean them ourselves  Nice bed Great location next to the metro station Staff polite and helpful ,neutral
 Very small rooms but new und modern No Positive,neutral
 room service was inedible and several days old the rooms need to be refurbished they are oldNo Positive,neutral
 Bit worn out and way too noisy from the underground lineNo Positive,neutral
 Very bad reception I arrived at the hotel at 9 am very tired from a very long trip Cambodia Thailand Paris I asked if I could have a room available for early check in Amandine at the reception said to me no room is available yet I told her that I have no choice than waiting at the lobby for the room and to be so kind to let me know if a room would be available before normal check in time She answerd me I can t inform you you just come back at 2 pm and that s it This way to answer is not acceptable In regards to the room it is acceptable but there is not enough light  Good Location just in front of Gare du Nord,neutral
 The bath towel was not new with multiple stains and strong smell of sweat I asked the reception to report why  Location,neutral
 the room we got was different from the photos posted on booking com it was underwhelming it was definitely not worth 400 for 2 nights At ALL good thing I paid almost half of it because of discount but still we were not satisfied location is fine,neutral
 There was no air conditioning had to move rooms 3 times untill 3 got a corner room with 3 windows This was ok if we left the windows open all day and night They were like sweat boxes The steam room and sauna were being cleaned serviced or not working twice in our 4 night stay This is barely a 4 hotel we stayed at olimpica suits 10 min walk away prior and that 4 hotel was incredible compared Way to expensive  The location was awesome and good breakfast but there was no air conditioning so sweating and no sleep through the night they said they only have cool air con from late May to save energy costs maybe they should charge less for the stay before May as we payed for an air con room which they don t have They told us too open the window Which resulted in mosquito bites The beach is literally 5 min walk away which was cool But this hotel is way over priced The staff were helpful and friendly and willing to help on our problems but ultimately I wouldn t stay here again Well not for this price ,neutral
 Impossible to use the Wi Fi ended up using my cell phone as a modem via 4G The room though very nice was above the Underground rails The racket from the trains was hardly bearable until about 01 00 a m even though we were on Floor 11 I can only guess what it might be like on lower floors  The location Friendliness of staff ,neutral
 The staff was extremely unfriendly impolite and could not not help me even with taxi proposing go on the street and check if there is one We came with 3 small children at 12 00 and reception refused to give us a room earlier than 14 00 which is official check in time saying if you want to check in earlier you should pay for the night before Finally I was charged additional 8 EUR for using internet which was a gesture of misery if you pay 350 EUR a night  The room was well furnished clean and comfortable ,neutral
 Easily the most uncomfortable bed we have ever slept in Close to Wembley stadium so very easy pre and post event,neutral
 the first impression of the hotel is a real disappointment outdated reception furniture which looks not only old but also really bad it seams dirty unsanitary even the hotel is close to the SElva del Mar metro station which is really helpful for getting around the city ,neutral
 Unfriendly staff No Positive,neutral
 poor facilities location,neutral
 over priced requested a different room and small size of the room  help full staff to a certain extent,neutral
 Hotel is very isolated unless the ferry to Canary Wharf works for you I chose the hotel because Booking com told me it was only a couple of miles from the venue in Wapping I was spending the evening at It didn t point out there was a bloody great river in the way and the taxi fare to get across was about 40 so the need to use bus and overground meant I had to leave before the end  Modern hotel nice view across the river to Canary Wharf although my room wasn t facing that way Warm cookie on check in although I had to remind the receptionist ,neutral
 Housekeeping staff were rude shower had water pressure and temperature problems and the hotel has double charged me and has yet to solve the issue  Great food very nice bar staff,neutral
 Tiny single room to be expected but this room was so hot There was a portable air conditioning unit in the room that was so noisy you could hear it when you came out of the lift 5 rooms away Impossible to sleep with the noise of that and the heat when it was turned off The shower also had a lot of black mold in around the tiles and all of the sealer Tiles were cracked and black in between them The bathroom and furniture in the single room leave a lot to be desired and are in desperate need of replacing No way a four star More like two One member of check in staff was also very rude to me They were unable to take card payments when I arrived as there was something wrong with their system She kept telling me to go to a cash point to get cash out to pay for my two nights stay and wanted another 50 cash as a deposit I told her I would do so in a while but wanted to go to my room first as I had a long journey getting to the hotel and wanted to drop my luggage off When I came down about half an hour later she shouted at me across the reception in front of other guests and asked me if I had fixed the problem with my card Not only was this incredibly rude and tactless of her it was also very inappropriate as my card was perfectly fine it was their system that was down She made me feel like some kind of low life When I came back with all of the cash for her she started speaking in a foreign language with the porter I couldnt say of she was talking about me as I didnt know the language The other receptionist then kindly asked them to refrain from doing this as they had a guest present and it was very rude of them to do so Instead of making me feel like a low life they could of easily just taken payment by my card when their system was up again Needless to say I wont be staying there again despite the great location  location was good,neutral
 Standard rooms were unclean and therefore many spots Besides the furniture is not up to the magnitude of the hotel That made me change my booking to a higher level  The location and the size of room,neutral
 Room was very worn and dirty Bedcover was stained It completely spoiled the whole impression  The room was very spacious Breakfast was delicious and was offered a wide range of options Near the hotel was a large free parking and transport to the city center by metro was very convenient ,neutral
 Very small room very dark lights Almost no storage place maximum 3 4 shirts I had to keep most of my stuff inside my luggage In most of the rooms NO shower handset As it was important for me I requested to change room and was told to wait at the room and that in 5 minutes a staff member will come to assist but came after 40 minutes I waited at the room At the breakfast I ordered a veterinarian omelet and asked specifically for no bacon but after the first bite I understood that bacon is one of my omelet ingredients Great location ,neutral
 Unclean bathroom tiles Woken by room cleaner at 9am to clean room on Sunday morning Told we should have booked directly to get a free breakfast so would charge us 12 each We went down the road to a cheaper cafe  Bar good and not too pricey Decoration beautiful art nouveau style ,neutral
 Rooms are extremely small  Location is excellent,neutral
 If you are travelling alone the single rooms will fall short of your expectation The rooms are very small and claustrophobic Beds are pushed up against windows with terrible drafts I had to use my clothes to seal window and a suitcase to protect myself from draft Very uncomfortable When asked to change to another room the same situation  Very friendly staff ,neutral
 Room was small and no heating The location and the buffet style breakfast,neutral
 no bath no milk for tea just creamif you need milk you have to pay english poeple like milk not what you would get from hoilday inn clean room,neutral
 The floor boards were creaky and was awaken night after night with movement from the room above I was offered room G10 the carpet were worn and old the shower room was impractical Not likely to stay there again  The location was fantastic as it was close to public transport ,neutral
 The twin room was so small that the beds actually touched and could not be moved apart I booked a twin so my daughter and I could stay together but no that close Also I paid 8GBP to use the gym and pool which were average You must pay a high price for internet and parking but I knew this prior to arriving so it was not unexpected  The staff on reception were very helpful and polite ,neutral
 Overall what we got was not what we expected from a four star hotel The hotel is quite old and the rooms are very small There s only one lift that takes ages to reach we sometimes had to use the stairs The lift itself is very small and can barely take 4 persons Breakfast however was our greatest disappointment We were offered continental breakfast with the room we took The breakfast area down the basement was quite dim and unwelcoming with dark antique furnishing Not the perfect atmosphere for your early morning breakfast the selection of food was very narrow Only one kind of cheese and no eggs There was no name tag under each dish we couldn t tell what type of meat was on the tray  Staff were very friendly always smiling and very helpful when asked for anything They changed the room the next day when we complained about how tiny our room was ,neutral
 Some of the staff did not speak English well the first room I was in had all the noises from the Resterant above  The location was very good,neutral
 Extremely small washroom room very tiny very basic roomNo Positive,neutral
 There was no air conditioning I booked a double and it was two twin beds put together I might have just as well booked and paid for a single  The breakfast was good but the plates were very small like they didn t want you to eat too much ,neutral
 Very small room construction work going on in the hotel woke us up in the morning Very basic breakfast facilities Great shower,neutral
 Room temperature was too hot we called the reception but still they couldn t control the room temperature We booked the hotel to use pool but when we went to the hotel they told us pool was closed very dissapointed and they only run one shuttle bus for 7 people so for people traveling in large groups it s a waste as the shuttle bus would always be not available Room was very trendy and modern,neutral
 Small noisy bedroom ridicously small shower room small and very dark corridors and lift shabby breakfast room Very nice staff good comfortable bed Good location ,neutral
 paid more on booking com for small room than what was offered at the hotel at rack rates for executive rooms with canal view a little disappointed in this to say the least location transportation,neutral
 room was small dated not good location,neutral
 room was small Restaurant staff were rude location,neutral
 Unbelievable 4 stars and ridiculously high price How this hotel can be 4 stars Room is very narrow bed is small no refrigerator narrow bathroom You cannot move your body in shower booth because it s too narrow  Location is near to subway ,neutral
 It is a tired hotel which was expensive compared to others we have stayed in very dark quite depressing interiors with terrible bedroom lighting and not many pictures etc to make a very large room comfortable My daughters bedroom was so small she could barely put her suitcase anywhere we didnt feel that we wanted to hang around there so spent as little time as possible which is a shame because it was expensive the position in Amsterdam is excellent,neutral
 Poor choice of bar food mine came up cold  Friendly staff,neutral
 From the hours wait to check in which still was not available at 5pm no tv working the long queue and the craziness at breakfast was like a poor quality holiday camp on speaking to the front of house manager the attitude of what do you want us to do was the final straw  The whole stay was very poor,neutral
 The room although big had absolutely nothing to do with the ones on the photos On the top of that it faced an inner yard and we could hear the guests on the room above us  Very nice and helpful staff good location beautiful ground floor ,neutral
 very small room but it is rather typical for Paris the cleanness was so so access to metro is fine if you don t carry heavy stuff I would appreciate segreggation of garbage especially as Paris hosted COP21 at that time the atmosphere very cosy place nice staff nicely looking hotel and rooms easy to find not very far gare d austerlitz,neutral
 Disappointing gym no air conditioning Not exactly welcome later in evening trying to use facilities  Good rooms,neutral
 Location of room used lift for 2 floors and then had to use stairs for 2 floors not good for 2 70 year olds Not enough choice for breakfast and food was indifferent  Proximity to the Albert Hall and tube Friendly and informative staff Quality of room ,neutral
 Little charme staff not very motivated Nice pool spacious room with two big beds good location close to tower,neutral
 2 lights were not working in the first room the first room a junior suite was very very tiny it should be forbidden to charge 600 per night for such a hutch The night curtain did not close in the first room and window overlooked the restaurant No bottle opener in the mini bar Breakfast shabby lacked everything and the staff were completely exceeded Staff at front desk and reception were very polite and try to accommodate our requests They made their best to change our room for the second night ,neutral
 The non disponibility of the net favilty at the room it to have be free all the time  The location of the hotel visa a vis transports facility metro bus ,neutral
 The room was very very compact as was the en suite The flooring in the room had seen better days  The cleanliness of the hotel was good and the staff were very friendly The continental breakfast was of an expectable standard We particularly liked the close proximity of the hotel to the Royal Park just 2 minutes walk away It was great that we could leave our luggage securely stored before our booking in time and during the day of our departure ,neutral
 Rooms were very standard for a 5 star hotel The staff would knock on your door several times in the morning to try and get in to clean  Good location hotel lobby very nice ,neutral
 Rooms very small whole hotel needs major money spending on it very very very noiseydue to rubbish collections staff on street all hours very limited bar breakfast looked very poor cafes nr bye for half the price very good quality beds very bad  Only the location ,neutral
 When I booked a small double I thought it was a smaller room not bed My 14 year old daughter and I slept in a 3 quarter bed Location tea making facilities good toiletries,neutral
 Completely over priced for what it is Hotel itself felt like a throw back to the 70 s I believe it was a converted school Rather depressing feel to it No Positive,neutral
 Noisy even on the 6th floor trams outside running all day and night every 30 seconds with very noisy rails shutter didn t close all the way and curtains didn t meet in the middle so it was a noisy night and light morning  Good location Room was clean,neutral
 No free WiFi Not allowed to bring food into the hotel Very loud neighbours who slammed the doors all night The hotel is close to restaurants and bars,neutral
 Our room was not the superior room we booked in our opinion Cleanliness could have been better mould around the shower screen signs of damp in the bedroom and dirty fingerprints on the service hatch in the ceiling Rooms were serviced daily but you could tell the floor had only been swept not mopped or polished  Comfy beds good soundproofing we asked for and got a quiet room with a view Close to rail station and good metro access to city centre ,neutral
 The bed wobbled every time you moved The housekeeping does not replace the coffee coffee cups you have to pay to get extra after the first night No milk either The WIFI is totally useless it automatically disconnects every few minutes and is painfully slow You can t get a good night sleep as the black out curtains don t block out the sun completely and the housekeeping staff are very loud come 8am Very disappointing stay  The hotel was clean ,neutral
 The room was very dusty the air conditioning blew dust around the room leaving me with allergies  The rooms are basic and doesn t equate to a 4 as suggested online The reception area and the facilities are ok ,neutral
 No parking even if on booking com says they have booked a double and received a twin asking for extra blankets as heating was not working and they never showed up with does blankets the worst experiences until now Location is good,neutral
 You have to leave your keys at reception every time You only get 1 key and we were 2 ppl Old fashioned way no badge system but an old key to open door Very very thin walls You could hear every thing Not enough sockets to charge your phone for example  There were 2 lifts available Air con Internet Location 10 15min walking distance to shops Nespresso coffee machine in room ,neutral
 Expensive over night stay Good location near Hyde Park,neutral
 Is very far from underground 20 min C,neutral
